<?xml version="1.0" encoding="UTF-8"?>
<constraints__flux_loop xmlns:xsi="http://www.w3.org/2001/XMLSchema-instance" xsi:noNamespaceSchemaLocation="../../../settings_schema/xsd/equilibrium/constraints_flux_loop.xsd">
    <flux_loop>
        <name>L001</name>
        <expected_value>0.05</expected_value>
        <weight>6.28</weight>
        <include>true</include>
        <comment/>
    </flux_loop>
    <flux_loop>
        <name>L002</name>
        <expected_value>0.05</expected_value>
        <weight>6.28</weight>
        <include>true</include>
        <comment/>
    </flux_loop>
    <flux_loop>
        <name>L003</name>
        <expected_value>0.05</expected_value>
        <weight>6.28</weight>
        <include>false</include>
        <comment>MCT flux loop dead</comment>
    </flux_loop>
    <flux_loop>
        <name>L004</name>
        <expected_value>0.05</expected_value>
        <weight>6.28</weight>
        <include>true</include>
        <comment/>
    </flux_loop>
    <flux_loop>
        <name>L005</name>
        <expected_value>0.05</expected_value>
        <weight>6.28</weight>
        <include>true</include>
        <comment/>
    </flux_loop>
    <flux_loop>
        <name>L006</name>
        <expected_value>0.05</expected_value>
        <weight>6.28</weight>
        <include>false</include>
        <comment>doesnt match DIV/SOL flat top</comment>
    </flux_loop>
    <flux_loop>
        <name>L007</name>
        <expected_value>0.05</expected_value>
        <weight>6.28</weight>
        <include>true</include>
        <comment/>
    </flux_loop>
    <flux_loop>
        <name>L008</name>
        <expected_value>0.05</expected_value>
        <weight>6.28</weight>
        <include>false</include>
        <comment>doesnt match DIV/SOL flat top</comment>
    </flux_loop>
    <flux_loop>
        <name>L009</name>
        <expected_value>0.05</expected_value>
        <weight>6.28</weight>
        <include>true</include>
        <comment/>
    </flux_loop>
    <flux_loop>
        <name>L010</name>
        <expected_value>0.05</expected_value>
        <weight>6.28</weight>
        <include>true</include>
        <comment/>
    </flux_loop>
    <flux_loop>
        <name>L011</name>
        <expected_value>0.05</expected_value>
        <weight>6.28</weight>
        <include>true</include>
        <comment/>
    </flux_loop>
    <flux_loop>
        <name>L012</name>
        <expected_value>0.05</expected_value>
        <weight>6.28</weight>
        <include>true</include>
        <comment/>
    </flux_loop>
    <flux_loop>
        <name>L013</name>
        <expected_value>0.05</expected_value>
        <weight>6.28</weight>
        <include>true</include>
        <comment/>
    </flux_loop>
    <flux_loop>
        <name>L014</name>
        <expected_value>0.05</expected_value>
        <weight>6.28</weight>
        <include>false</include>
        <comment/>
    </flux_loop>
    <flux_loop>
        <name>L015</name>
        <expected_value>0.05</expected_value>
        <weight>6.28</weight>
        <include>true</include>
        <comment/>
    </flux_loop>
    <flux_loop>
        <name>L016</name>
        <expected_value>0.05</expected_value>
        <weight>6.28</weight>
        <include>true</include>
        <comment/>
    </flux_loop>
    <flux_loop>
        <name>L017</name>
        <expected_value>0.05</expected_value>
        <weight>6.28</weight>
        <include>true</include>
        <comment/>
    </flux_loop>
    <flux_loop>
        <name>L018</name>
        <expected_value>0.05</expected_value>
        <weight>6.28</weight>
        <include>true</include>
        <comment/>
    </flux_loop>
    <flux_loop>
        <name>L019</name>
        <expected_value>0.05</expected_value>
        <weight>6.28</weight>
        <include>true</include>
        <comment/>
    </flux_loop>
    <flux_loop>
        <name>L020</name>
        <expected_value>0.05</expected_value>
        <weight>6.28</weight>
        <include>true</include>
        <comment/>
    </flux_loop>
    <flux_loop>
        <name>L021</name>
        <expected_value>0.05</expected_value>
        <weight>6.28</weight>
        <include>true</include>
        <comment/>
    </flux_loop>
    <flux_loop>
        <name>L022</name>
        <expected_value>0.05</expected_value>
        <weight>6.28</weight>
        <include>false</include>
        <comment>Very high noise; probably dead; extremely wrong in DIV flat top</comment>
    </flux_loop>
    <flux_loop>
        <name>L023</name>
        <expected_value>0.05</expected_value>
        <weight>6.28</weight>
        <include>false</include>
        <comment>doesnt match DIV/SOL flat top</comment>
    </flux_loop>
    <flux_loop>
        <name>L024</name>
        <expected_value>0.05</expected_value>
        <weight>6.28</weight>
        <include>true</include>
        <comment/>
    </flux_loop>
    <flux_loop>
        <name>L025</name>
        <expected_value>0.05</expected_value>
        <weight>6.28</weight>
        <include>true</include>
        <comment/>
    </flux_loop>
    <flux_loop>
        <name>L026</name>
        <expected_value>0.05</expected_value>
        <weight>6.28</weight>
        <include>true</include>
        <comment/>
    </flux_loop>
    <flux_loop>
        <name>L027</name>
        <expected_value>0.05</expected_value>
        <weight>6.28</weight>
        <include>true</include>
        <comment/>
    </flux_loop>
    <flux_loop>
        <name>L029</name>
        <expected_value>0.05</expected_value>
        <weight>6.28</weight>
        <include>true</include>
        <comment/>
    </flux_loop>
    <flux_loop>
        <name>L030</name>
        <expected_value>0.05</expected_value>
        <weight>6.28</weight>
        <include>false</include>
        <comment>doesnt match DIV/SOL flat top</comment>
    </flux_loop>
    <flux_loop>
        <name>L101</name>
        <expected_value>0.05</expected_value>
        <weight>6.28</weight>
        <include>false</include>
        <comment/>
    </flux_loop>
    <flux_loop>
        <name>L102</name>
        <expected_value>0.05</expected_value>
        <weight>6.28</weight>
        <include>false</include>
        <comment/>
    </flux_loop>
    <flux_loop>
        <name>L103</name>
        <expected_value>0.05</expected_value>
        <weight>6.28</weight>
        <include>false</include>
        <comment/>
    </flux_loop>
    <flux_loop>
        <name>L104</name>
        <expected_value>0.05</expected_value>
        <weight>6.28</weight>
        <include>false</include>
        <comment/>
    </flux_loop>
    <flux_loop>
        <name>L105</name>
        <expected_value>0.05</expected_value>
        <weight>6.28</weight>
        <include>false</include>
        <comment/>
    </flux_loop>
    <flux_loop>
        <name>L106</name>
        <expected_value>0.05</expected_value>
        <weight>6.28</weight>
        <include>false</include>
        <comment/>
    </flux_loop>
    <flux_loop>
        <name>L201</name>
        <expected_value>0.05</expected_value>
        <weight>6.28</weight>
        <include>false</include>
        <comment/>
    </flux_loop>
    <flux_loop>
        <name>L202</name>
        <expected_value>0.05</expected_value>
        <weight>6.28</weight>
        <include>false</include>
        <comment/>
    </flux_loop>
    <flux_loop>
        <name>L203</name>
        <expected_value>0.05</expected_value>
        <weight>6.28</weight>
        <include>false</include>
        <comment/>
    </flux_loop>
    <flux_loop>
        <name>L210</name>
        <expected_value>0.05</expected_value>
        <weight>6.28</weight>
        <include>false</include>
        <comment/>
    </flux_loop>
    <flux_loop>
        <name>L211</name>
        <expected_value>0.05</expected_value>
        <weight>6.28</weight>
        <include>false</include>
        <comment/>
    </flux_loop>
    <flux_loop>
        <name>L212</name>
        <expected_value>0.05</expected_value>
        <weight>6.28</weight>
        <include>false</include>
        <comment/>
    </flux_loop>
</constraints__flux_loop>
